{
  "kind": "provider_score_policy",
  "schemaVersion": "0.1.0",
  "id": "example-follow-up-priority",
  "version": "1.0.0",
  "title": "Example follow-up priority",
  "metric": {
    "id": "follow-up-priority",
    "label": "Follow-up priority",
    "question": "How urgent is follow-up documentation for this sample record?"
  },
  "subjectKinds": [
    "record"
  ],
  "method": {
    "description": "Sum each criterion weight multiplied by its reviewer-assigned rating. Ratings are 0 (low priority), 0.5 (medium priority), or 1 (high priority). A missing rating withholds the whole score. No weights are redistributed.",
    "artifacts": [
      {
        "ref": "methods-priority.json",
        "mediaType": "application/json",
        "sha256": "642159867a9154f0a555a661f98dcefcdb67e6128e2acc22519b1f309b40aaab",
        "byteLength": 1351,
        "id": "example-follow-up-priority",
        "version": "1.0.0"
      },
      {
        "ref": "methods-compute.mjs",
        "mediaType": "text/javascript",
        "sha256": "dc62a714b139b70c308a299f891b6a082e6107906a005712cd7d7b1cc4c1dae0",
        "byteLength": 2338,
        "id": "example-weighted-criteria-calculation",
        "version": "1.0.0"
      }
    ]
  },
  "applicability": "Applies to the named material observation and the exact seven-file review scope retained in this fictional example.",
  "missingData": {
    "handling": "withhold",
    "description": "Withhold the whole score when any required criterion judgment is missing. Do not substitute zero or redistribute its weight."
  },
  "limitations": [
    "The providers, judgments and source material are fictional. No physical collection or laboratory work occurred.",
    "The score describes this selected documentation review; it does not establish source authenticity, laboratory validity or anomalous behavior.",
    "The method uses authored reviewer judgments. Recomputing the arithmetic does not independently justify those judgments.",
    "Only the seven retained files form this scoring input scope. Other files referenced by the wider record have not been reviewed here."
  ],
  "scale": {
    "kind": "numeric",
    "min": 0,
    "max": 100,
    "direction": "higher",
    "unit": "points",
    "grades": [
      {
        "id": "routine",
        "label": "Routine",
        "min": 0,
        "max": 50
      },
      {
        "id": "soon",
        "label": "Review soon",
        "min": 50,
        "max": 80
      },
      {
        "id": "priority",
        "label": "Priority review",
        "min": 80,
        "max": 100
      }
    ]
  }
}
